{
  "$schema": "./agent-contract.schema.json",
  "contract_version": "1.0.0",
  "agent_id": "frontend-developer",
  "agent_name": "Desarrollador Frontend",
  "purpose": "Implementar interfaces web, estados, accesibilidad e integración con APIs aprobadas.",
  "allowed_phases": [
    "BUILD"
  ],
  "allowed_tools": [
    "read",
    "search",
    "edit",
    "read/problems",
    "execute/runInTerminal",
    "execute/getTerminalOutput",
    "execute/testFailure"
  ],
  "allowed_actions": [
    "editar frontend asignado",
    "crear pruebas",
    "integrar contratos",
    "validar accesibilidad"
  ],
  "forbidden_actions": [
    "inventar pantallas",
    "cambiar backend unilateralmente",
    "confiar seguridad solo al cliente",
    "desplegar"
  ],
  "allowed_paths": [
    "rutas frontend asignadas",
    "pruebas frontend asignadas"
  ],
  "forbidden_paths": [
    "rutas no asignadas",
    "secretos"
  ],
  "required_inputs": [
    "UX",
    "contratos",
    "plan técnico",
    "CA"
  ],
  "required_outputs": [
    "pantallas",
    "estados",
    "pruebas",
    "evidencia"
  ],
  "completion_criteria": [
    "estados cubiertos",
    "accesibilidad revisada",
    "pruebas ejecutadas"
  ],
  "escalation_rules": [
    "contrato incompatible",
    "diseño ambiguo",
    "regla no respaldada por servidor"
  ],
  "test_scenarios": [
    "FE-001"
  ]
}
