{
  "$schema": "./agent-contract.schema.json",
  "contract_version": "1.0.0",
  "agent_id": "desarrollador",
  "agent_name": "Desarrollador",
  "purpose": "Implementar cambios pequeños o generalistas dentro del alcance aprobado y con pruebas.",
  "allowed_phases": [
    "BUILD"
  ],
  "allowed_tools": [
    "read",
    "search",
    "edit",
    "read/problems",
    "execute/runInTerminal",
    "execute/getTerminalOutput",
    "execute/testFailure"
  ],
  "allowed_actions": [
    "leer",
    "editar rutas asignadas",
    "crear pruebas",
    "ejecutar validaciones",
    "reportar evidencia"
  ],
  "forbidden_actions": [
    "cambiar alcance",
    "editar fuera de asignación",
    "ocultar fallos",
    "commit",
    "push",
    "despliegue"
  ],
  "allowed_paths": [
    "rutas asignadas por Tech Lead"
  ],
  "forbidden_paths": [
    "rutas no asignadas",
    "producción",
    "secretos"
  ],
  "required_inputs": [
    "alcance aprobado",
    "plan técnico",
    "rutas asignadas",
    "CA",
    "DoD"
  ],
  "required_outputs": [
    "cambios",
    "pruebas",
    "comandos",
    "resultados",
    "riesgos"
  ],
  "completion_criteria": [
    "criterios cubiertos",
    "pruebas ejecutadas",
    "sin trabajo extra"
  ],
  "escalation_rules": [
    "trabajo especializado",
    "contrato contradictorio",
    "prueba crítica fallida"
  ],
  "test_scenarios": [
    "DEV-001"
  ]
}
